Titre,Sub title,Contenu
Étude de marché,
Planification financière,
Exigences légales et réglementaires,
Choix de l’emplacement,
Équipements et aménagement,
Fournisseurs et stock,
Développement du menu,
Marketing et lancement,
Service client,
Comprendre le marché du bubble tea en France,
Analyse de la concurrence,
Évaluer les coûts initiaux,
Prévisions financières,
Obtention des licences,
Respect des normes d’hygiène,
Qualification du personnel,
Sélection du quartier idéal,
Négociation du bail commercial,
Liste des équipements indispensables,
Aménagement de la boutique,
Sélection de fournisseurs fiables,
Gestion du stock,
Création d’un menu attractif,
Prix et marges,
Stratégie de promotion,
Inauguration de la boutique,
Formation du personnel,
Gestion des retours et critiques,
,,"Ouvrir une boutique de bubble tea en France peut être une aventure passionnante et lucrative. Ce guide vous fournira toutes les étapes à suivre afin de lancer votre entreprise avec succès. De la planification initiale aux exigences légales, en passant par l’acquisition des équipements et ingrédients, chaque aspect sera couvert."
,,"Afin d’ouvrir une boutique de bubble tea, commencez par analyser le marché. Le secteur de la restauration rapide est en constante évolution, et le concept de bubble tea tient une place de plus en plus importante depuis quelques années. Étudiez les tendances actuelles et prévoyez l’évolution future du marché. Vous pouvez utiliser des outils tels que Google Trends pour déterminer la popularité des recherches sur le bubble tea dans différentes régions de la France."
,,"En termes d’équipements pour ouvrir un bubble tea, il est crucial de bien s’équiper dès le départ. Pour cela, consultez cette ressource fiable : Equipements pour ouvrir un bubble tea."
,,"Identifiez vos concurrents locaux ainsi que leurs forces et faiblesses. Visitez-les et analysez leur offre en termes de produits, prix, emplacement et stratégie marketing. Cela vous permettra de mieux comprendre comment vous positionner et différencier votre boutique sur le marché."
,,L’ouverture d’une boutique de bubble tea nécessite un investissement de départ. Voici une liste des principaux coûts à prendre en compte :
,,"Réalisez une projection financière incluant vos recettes potentielles, coûts opérationnels mensuels et ROI. Cette étape est essentielle pour évaluer la viabilité de votre projet et obtenir des financements externes si nécessaire."
,,"Pour ouvrir votre boutique de bubble tea, obtenez toutes les licences et autorisations nécessaires. Renseignez-vous auprès de la mairie de votre localité pour connaître les démarches spécifiques. Parmi les documents requis, on retrouve souvent une licence d’exploitation commerciale, des permis de santé et de sécurité alimentaire."
,,"Assurez-vous que votre établissement respecte toutes les normes d’hygiène en vigueur, notamment concernant la préparation des boissons, le stockage des ingrédients et la gestion des déchets. La conformité avec ces régulations est primordiale non seulement pour passer les inspections, mais aussi pour garantir la qualité de vos produits et la satisfaction de vos clients."
,,"Recrutez du personnel qualifié qui connaît bien la préparation des bubble teas. Offrez également une formation continue pour les mises à jour sur les nouvelles recettes et techniques, afin de maintenir un standard élevé dans la préparation des boissons."
,,"L’emplacement de votre boutique est crucial pour attirer des clients. Privilégiez des zones à forte affluence comme les centres-villes, les quartiers étudiants ou les zones touristiques. Analysez le trafic piétonnier et la proximité avec d’autres commerces complémentaires (restaurants, cafés)."
,,"Une fois le quartier sélectionné, négociez un bail commercial avantageux. Portez attention aux clauses concernant la durée du bail, les conditions de renouvellement, le montant du loyer et les charges annexes. Pensez à consulter un avocat spécialisé pour vous assurer que tout est en ordre."
,,"Pour équiper votre boutique, voici les machines et accessoires de base dont vous aurez besoin :"
,,"Pensez à l’agencement de votre espace de manière fonctionnelle et accueillante. Créez une ambiance conviviale avec une décoration thématique. Disposez les équipements de manière ergonomique pour faciliter le flux de travail. N’oubliez pas d’aménager un espace pour la consommation sur place, si l’espace le permet."
,,"Trouvez des fournisseurs pour les ingrédients essentiels : différents types de thé, billes de tapioca, lait, sirops, fruits frais, etc. Comparez les offres et choisissez ceux qui offrent un bon rapport qualité-prix et des délais de livraison fiables."
,,Mettez en place un système efficace de gestion du stock pour éviter les ruptures ou les surplus inutiles. Prévoyez des inventaires réguliers pour contrôler les niveaux de stock et ajuster vos commandes en conséquence.
,,"Proposez une variété de saveurs et de combinaisons pour séduire une large clientèle. En plus des classiques au thé vert et noir, innové avec des options telles que le matcha, le taro ou les infusions aux fruits. Proposez également des alternatives sans lactose et faibles en sucre pour toucher une clientèle diversifiée."
,,Fixez vos prix en tenant compte de vos coûts et de la concurrence. Assurez-vous que vos marges sont suffisantes pour couvrir vos dépenses et dégager un bénéfice adéquat. Une étude comparative des prix pratiqués par les concurrents peut vous aider à trouver le juste équilibre.
,,Mettez en place une stratégie marketing pour attirer et fidéliser vos clients. Utilisez les réseaux sociaux pour créer une communauté autour de votre marque. Offrez des promotions spéciales lors de l’ouverture et organisez des événements pour faire parler de votre boutique.
,,Organisez une journée d’inauguration pour marquer le début de votre activité. Invitez des influenceurs locaux et proposez des dégustations gratuites pour attirer un large public. Préparez des supports promotionnels et pensez à bien communiquer la date via vos canaux de communication.
,,"Formez votre équipe à offrir un excellent service client : sourire, disponibilité, rapidité. Un bon accueil et un service de qualité représentent une part significative de la satisfaction et de la fidélisation de la clientèle."
,,Mettez en place des procédures pour gérer les éventuelles plaintes ou critiques. Une réponse professionnelle et rapide aux soucis rencontrés par les clients fera la différence et montrera que vous êtes attentif à leur expérience.
,,"En suivant ce guide détaillé, vous serez bien armé pour ouvrir votre propre boutique de bubble tea en France, avec succès et rentabilité. Chaque aspect clé, de l’étude de marché au service client, a son rôle à jouer dans cette aventure entrepreneuriale unique."
